{
  "preview_path": "D:\\Projects\\SiligenSuite\\packages\\engineering-contracts\\fixtures\\cases\\rect_diag\\rect_diag-preview.html",
  "entity_count": 5,
  "segment_count": 5,
  "point_count": 10,
  "total_length_mm": 541.4213562373095,
  "estimated_time_s": 54.14213562373095,
  "width_mm": 100.0,
  "height_mm": 100.0
}
